character,line
Dean Pelton,"Okay, this awkward silence has been going on for days. Granted, Jeffrey looks amazing when he broods, but this has got to stop. Now, I don't know what happened, but we have to get to the bottom of this."
Annie,It's too embarrassing.
Dean Pelton,"I understand. You don't wanna talk about it, and you won't have to. They will talk for you."
Jeff,"Why did you make, have, and bring these?"
Dean Pelton,Mmm.
Jeff,Don't answer.
Britta,It's puppet therapy.
Dean Pelton,Mm-hmm.
Britta,The psychology world has recently embraced it after seeing it on
Dean Pelton,"You'll notice that each puppet is made in your likeness. They were a rush job. It's not like I had them on hand for personal use. Excuse me. Let me just grab this thing that's definitely not a whip. In addition to being adorable, I know firsthand that puppet therapy can and does work."
Kevin,"Uh, Dean, puppet Kevin here thinks I should have a candy bar right now."
Dean Pelton,"No, you know how it winds you up."
Kevin,"Fine. We'll split it. All right. Got money, bro? He's not what he seems!"
Dean Pelton,"Wait. Where's Pierce? I know he's not with us, but is he still with us?"
Troy,"I'm sure he's fine. Although, no one's seen him since he lost his mind in the woods."
Dean Pelton,"You all were in the woods? Oh. Oh, so the puppets are working. Okay. Uh...How did it start? What happened?"
Jeff,We're not playing with puppets.
Dean Pelton,"Oh, Jeffrey."
Shirley,"Dean, what happened is between us and Jesus, and Jesus don't snitch."
Abed,"Yeah, and I don't need a puppet to express myself. I already say whatever I want. But I am a fan of the medium, so..."
Dean Pelton,Ow. Hmm. That's interesting.
Britta,"Guys, are we just gonna avoid making eye contact forever? Who are we, Jeff during sex?"
Annie,Huh?
Britta,Let's just give it a shot and move on.
Jeff,"Fine. If we're gonna play this game, then, unlike sex with Britta, we're gonna do it quickly and with a small shred of dignity."
Britta,Eh.
Troy,Yeah.
Dean Pelton,"Jeffrey, dignity is my middle name, and my first name is Dean-nocchio! Ta, ta, ta, da! Ta, ta, ta, da! Whoo."
Abed,It all started on Friday. Britta was talking about a few of her latest causes.
Britta,"This one's for the Greendale animal shelter, this one's for global warming, this one's for global cooling, and..."
Jeff,This one's for the amount of rubber wasted while making stupid bracelets.
Britta,"That's called rubber flubbing, and it's a real problem. Open your eyes, people!"
Troy,"Britta said, ""Open your eyes, people."" Square."
Abed,Nice.
Jeff,What are you two doing?
Abed,"Oh. We're playing ""Study Group Bingo."""
Shirley,Study group bingo?
Abed,"We've been best friends for four years, so we've fallen into a comfortable, repetitive pattern like humorous misunderstandings on Three's Company or girls gossiping on Gossip Girl. So to liven things up, Troy and I made this bingo chart of the predictable things we say."
Pierce,This game is gay.
Troy,Square.
Shirley,You're mocking us? That's not a very Christian thing to do.
Abed,Square.
Shirley,Oh.
Annie,Can we go back to studying now?
Troy and Abed,Square.
Annie,I don't like this game.
Pierce,Me neither.
Shirley,I think it's mean.
Britta,There's no point.
Annie,"Yeah, it's insulting."
Jeff,"Okay, stop."
The Study Group,Square.
Jeff,Uh. Abed's right. We've had the same conversation a million times. I guess we're kind of stuck in a...
Study Group,Rut?
Jeff,"Yes. But to be fair, there's not many things you could be stuck in."
Annie,Elevators.
Shirley,Bad marriages.
Annie,A peat bog.
Pierce,On a flight in the middle seat.
Abed,Time loops.
Britta,The bottom of a well.
Troy,Your own emotions.
Abed,Quicksand.
Jeff,"Okay, stop!"
Study Group,Square.
Jeff,How did we get so predictable?
Dean Pelton,"And here is our state-of-the-art 1989 library where...oh, look! It is my favorite study group. They all really typify the diversity we have here at Greendale. Uh, ruggedly handsome leading man...a mom, an activist, a perfect student, a lifelong learner, a sidekick, and Abed. Enough foreplay. It's time to move this tour along to meet my good friend"
Jeff,"Look, the problem isn't us. We're awesome. The problem is Greendale. It's pulling our strings, and we need a break."
Abed,"Yeah, our Ferris Bueller needs a day off. Hey, whose dad has a vintage Ferrari?"
Annie,"Abed, a"
Shirley,"That's a good idea, Annie, but there's one problem. Where would we go?"
(various singing),"Where? Where would we go? We can go anywhere that you know. Could we travel through time? Or maybe see France? Or anywhere else naked ladies will dance. Could we fly in a booth? Could we go to church camp? I'd rather stay at Greendale. Could we ride a hot air balloon? Yes! Now that's an adventure. We should go soon. We could go anywhere in a balloon. Yes! That's an adventure. We can go high. We can see anything up in the sky. Yes, now that's an adventure. Pierce bring your dentures. We're so thrilled because soon, we'll be in a hot air balloon. Awww, awww, awww."
(singing),"Hey, guys. I'm the balloon guide. Before we take off, I'm gonna check the balloon ties. Look at the burner. Check out the basket. If you have a question, feel free to ask it."
(singing),Could we go to space?
(singing),Could we go to heaven?
(singing),I'd rather fly to Vegas.
(singing),It's getting time to ride the balloon
(singing),"Yes! Now this is adventure about to go soon. We're gonna go anywhere in the balloon. Yes, this is adventure, we're starting to fly. We can see everything here in the sky. This is adventure, there's beautiful weather now outside and we're fine as long as we have..."
Jeff,A balloon guide.
Study Group,"Oh, no! Oh, boy."
Balloon guide,"From now on, no more singing in the balloon."
Kevin,Did I miss it?
Balloon guide,Miss what? Who said anything about a runaway balloon?
Kevin,"Okay, let me process this. No!"
Study Group,"Oh, God. Whoa, whoa. We're really high. I'm really scared of heights."
Jeff,"Guys, what are we gonna do?"
Britta,I had a dream it would end this way.
Dean Pelton,"Oh, Jeffrey, you're on a runaway balloon? You could have died. You could have died. How could you almost let him die?"
Britta,"We all almost died, but we all didn't."
Shirley,"You know, plus, a near death experience would've only brought us closer together."
Annie,Good point.
Abed,Although it did get pretty hairy after that especially once Pierce started helping.
Pierce,"Okay, everyone push down with me at the same time. One, two, three! Come on, people. I can't do this alone."
Britta,You can't do it at all.
Pierce,"Oh, look. A downstream."
Study Group,Pierce! No! Whoa!
Troy,"If we fly to heaven, please don't tell my grandpa about me and Britta."
Jeff,This is not good.
Britta,There are so many clouds. It's so dark!
Troy,I can't even see the Landing Strip or any of the other nudie bars.
Shirley,"Oh, heaven, help us."
Annie,We must be a mile above the ground.
Pierce,That's international airspace. We're literally above the law. Jeff can marry any man he wants.
Jeff,"Wait a second, guys. I think we're starting to go down."
Shirley,You see? Prayer works.
Britta,"So does gravity, Shirley."
Shirley,"And you know who invented gravity, right?"
Study Group,Oh. Whoa!
Jeff,"Guys, let's put a pin in the mysteries of the universe convo until we land."
Abed,"Which will be sooner than we thought. We're gaining speed fast, people. Oh! Brace for impact."
Shirley,"Oh, damn you, gravity!"
Britta,"Damn you, prayer!"
Pierce,"Damn you,"
Study Group,Aaaah!
Troy,Has anyone else noticed
Study Group,Aaaah!
Pierce,Maybe I can soften our descent.
Study Group,"Pierce, no!"
Britta,"Bring it to me strong, old man monkey strength!"
Dean Pelton,"Okay. Okay, obviously, that was very scary. Post-traumatic stress is a real issue, but with these puppets giving voice to our feelings, we can begin to heal."
Troy,"Hey, come on."
Dean Pelton,This is gonna be a long and arduous process.
Abed,There's more.
Dean Pelton,"Hey, well, excuse Dean for reacting to the natural lull in your story. I'm so sorry. When you hurt, I hurt. What happened next?"
Troy,Whoa.
Britta,We made it. Everyone okay?
Pierce,I'm alive.
Troy and Abed,Square.
Jeff,"Guys, knock it off. Okay, we're all safe. We just have to figure out how to get back to Greendale."
Annie,But we're in the middle of the woods. Where do we start?
Abed,"We need to split into two groups, the survivors and the others. Where's the manifest?"
Shirley,"Oh, stop it with your"
Britta,What if we're stuck here?
Pierce,We need to start a prison system.
Troy,"We'll be stranded here forever, and I've never seen"
Annie,"Guys, guys, we're gonna make it outta here. We gotta relax. We're all gonna be fine."
Study Group,Ahh!
Shirley,What is that?
Annie,"I just want to say, if we're gonna die, I love you guys."
Britta,I love you all too.
Troy,I did see Blue Man Group. I just didn't get it. Why can't they talk? They have so much in common.
Study Group,Ahh!
Abed,Others!
Mountain man,Aaah! Oh! I'm sorry. I didn't mean to startle anybody.
Jeff,And I thought my hair looked fake.
Mountain man,"Oh, you guys are a long, long way from Greendale."
Jeff,How did you know we're from Greendale?
Mountain man,"Oh, from Pierce's shirt."
Pierce,How did you know my name is Pierce?
Mountain man,It's embroidered on your Greendale shirt you got at the student store.
Pierce,How'd you know I got it at the student store?
Mountain man,I'm a touch psychic.
Study Group,Oh! Huh. Hmm.
Mountain man,"Anyway, I used to go to Greendale just like you guys before I came out here to be free."
Jeff,"So this is how Greendale graduates end up, as transient mountain men. Huh. Not as bad as I thought."
Troy,But don't you miss having stuff?
Mountain man,"Out here, you have everything you need. And you can be whoever you wanna be."
Study Group,Huh.
(singing),"Here in the woods, you're totally be free. You can live off the land and be who you want to be."
(singing),We can be our own men.
(singing),And I don't need an A.
(singing),The perfect mom pressure would all go away.
(singing),Greendale is crazy.
(singing),And so is that moose.
Moose,"Hi, Troy."
(singing),Greendale turns people's screws so loose.
(singing),We're no exception to tell you the truth.
(singing),Which is why the woods is perfect for all of you.
(singing),Being socially conscious can be really tough.
(singing),"Ah, here in the woods, you can forget all that stuff."
(singing),I don't like the pressure to always be cool.
(singing),I was gonna say that. Now I don't have a rhyme.
(singing),We all try our hardest...
(singing),But the pressure in college.
(singing),Sometimes get so tremendous...
(singing),That it would be stupendous.
(singing),"To be free, far away..."
(singing),From Greendale.
Britta,I really love these berries. Where are they from?
Troy,My hand is made of rainbow and is magical.
Shirley,They make everything swirl.
Study Group,"Now, we're free far away from Greendale."
Mountain man,Be free my friends. Be free.
Dean Pelton,"Simply inspiring. Ten minutes ago, you weren't even speaking. And now, you've admitted that a strange man hand-fed you psychotropic berries. This is puppet therapy work..."
Garrett Lambert,Dean! There is a fire in the cafeteria!
Dean Pelton,"Garrett, not now! Where was I? Ah! I was healing you. Hmm? Go on."
Shirley,"Well, those devil berries freed our minds and loosened our tongues."
Britta,Your skin is so beautiful and soft. It's like felt.
Troy,"I feel so free out here, like I'm my own man. If Jeff said we had to live out here, I'd totally be down with that."
Britta,Me too.
Shirley,Can I tell you guys a secret?
Study Group,"Yeah, sure."
Shirley,"I was at the grocery store with my kids, and I thought I saw"
Jeff,I love women.
Britta,Mmm.
Pierce,I'm gonna go take a growler.
Shirley,"Anyway, I wanted to follow Andre and the woman, so I left my kids at the magazine stand for just a minute, but somehow, I lost track of time and ended up tailing them all the way out of town. It wasn't even Andre. The horrible part is I forgot my kids and left them all night in the grocery store."
Shirley,"Well, there y'all go, giving me that look, treating me like Judas, judging me like Judy. You know, Judge Judy. She judges people."
Britta,"Shirley, this is the first I've heard of you leaving your kids in a grocery store."
Abed,Me too. I have no memory of you saying that.
Shirley,"Well, if you don't know my secret, why have we all been so awkward around each other?"
Britta,I thought everyone heard my secret.
Annie,I didn't hear you say anything. So nobody else heard my terrible secret about how I...trail off from time to time?
Jeff,Did everyone here reveal a secret?
Study Group,Mm-hmm.
Jeff,"And no one remembers anyone else's, including mine?"
Study Group,Mm-mm.
Troy,Those berries made us real talky but not real listen-y.
Jeff,So if no one heard or remembers anything anyone else said...
Abed,We're in the clear!
Annie,We're in the clear! We're in the clear!
Dean Pelton,I'm a genius! Yeah!
Study Group,We're in the clear!
Annie,"Um, guys?"
Shirley,"Um, don't mind me. I'm sure you guys can get on with your lives without the worst mom ever."
Abed,Sounds good. Anyone up for a movie?
Jeff,"Abed, sit. Shirley, you have nothing to be ashamed of. No one thinks you're a bad mom."
Shirley,"Thanks, Jeff, but I'm...I'm just gonna go home now."
Jeff,"Shirley, wait. I think I know how to make you feel a little less horrible."
Britta,"I like where you're headed. Okay, who's holding? I have four berries, but I am saving them for Laser Floyd."
Jeff,"No, we all need to re-share our secrets sober."
Britta,"Oh, God."
Jeff,"Look, we were all feeling crappy earlier, but at least we were feeling crappy together. Shirley is alone now. This is the only way to put us on equal footing, and if it makes it any easier, we can use these puppets."
Dean Pelton,"Ah, yay!"
Jeff,Shut up.
Britta,Okay.
Jeff,I found the perfect girl for me. And then I met her kid.
(singing),"I said it didn't bother me. But truthfully it did. I promised him I'd make it to a baseball game he had. But I bailed and never called again, and now I'm just exactly like"
(singing),I am an activist. That's always been my choice. Truth is I never voted except when I watched
(singing),I was struggling in history. I'm normally the best. I let
(singing),I caused the Greendale fire of '03. Fifty-five acres went up in ablaze all because I burned an ant hill.
(singing),The secret inside me was trapped beyond a doubt. And now my most terrible secret's out.
Balloon guide,There you are. Come on you guys.
(singing),I never slept with the great
(singing),The secret inside me was trapped beyond a doubt.
(singing),Now my most terrible secret's out.
Dean Pelton,"I wanna thank you all for being so open, and honest, and for syncing your mouth and hand movements. And now, for my most terrible secret. I am not what you would call traditionally..."
Britta,"Wait, Abed, you never told us your secret."
Annie,Oh.
Shirley,That's right.
Abed,"I didn't share one that night. After we got back from the woods, everyone was being silent and not making eye contact. I didn't know why, so I mirrored your behavior."
Annie and Shirley,Awww!
Abed,Mmm.
Shirley,"Thank you, Jeff, and I don't think you're anything like your father."
Jeff,"I don't know how you take care of one kid, let alone three."
Shirley,Aww. That's nice.
Annie,So nobody thinks I'm a slutty cheater?
Study Group,No.
Troy,Or me as a criminal?
Study Group,No.
Britta,"Nobody respects me any less as a political activist, right?"
Annie,"Well, uh..."
Jeff,The level to which we respect you as a political activist has definitely not changed.
Troy,That's right.
Annie,That's how I would say it.
Troy,Exactly.
Britta,Whew.
Shirley,"Bye, Dean."
Dean Pelton,Bye.
Jeff,Yard mars at
Abed,Knowledge is a party.
Dean Pelton,"Once again, I help fix everyone's problems only to go home alone."
Jeff,Who says you have to be alone?
Dean Pelton,Jeffrey.
