character,line
Student,Ha-ha-ha!
Dean Pelton,"Whoa! What's that sound? Is that the tippy-tapping of secular boots on the roof? Oh, well, it must be yet another sign that it 'tis the season, because rumor has it that non-denominational Mr. Winter is on his way to the student lounge."
Shirley,I am so sick of the dean jamming his PCness down my throat.
Jeff,"Pierce, I'd like to commend you for letting that one go."
Troy,PCness. Now I get it.
Troy,It sounds like pen1s. I just got it too.
Shirley,"Well, it's still Christmas to all of us. And I made you all a little gift, because you're like my new family."
Annie,"""W.W.B.J.D?"""
Pierce,"If that stands for ""What would Billy Joel do?"" I'll tell you right now, he'd write another crappy song."
Troy,"Yeah, in your face, Billy Joel. Who is that?"
Shirley,"It stands for ""What would baby Jesus do? "" And it's to remind us that the real meaning of this season is Christmas."
Britta,"Oh, well, thank you, Shirley. I'm gonna put that in the pocket closest to my heart."
Shirley,"No, no, no. It's a bracelet, you put them on. Everybody put them on."
Mike,"Hey. Hey. You took all the Winter-Doodles. What are you, a douche bag?"
Abed,They're for my friends. But there's a lot left.
Mike,No. Only macadamia nut cookies. I have a tree-nut allergy.
Abed,Then you should probably stay away from Christmas-tree-shaped cookies.
Mike,"Ha-ha-ha! That did not even make allergic sense. What are you, an idiot?"
Jeff,"Okay, we get it, you and the A-Team are awesome, now beat it."
Mike,"Oh, look at that. Pretty boy, standing up for bird-face over here. Give me a Winter-Doodle."
Jeff,"If you're trying to be menacing, maybe don't call the cookie by its name."
Mike,"Oh, you're funny, you're a funny man. Wanna hear something funny? Knock, knock. My fist up your ba*ls."
Jeff,Who's there?
Dean Pelton,"Ho, ho, ho! Merry happy."
Mike,"This ain't over. There won't always be a dean around, all right?"
Pierce,"Still waiting on those cookies, Abed. Give me some rope, time in a tree give me the hope to run out of steam somebody said we could be here we could be roped up, tied up, dead in a year I can't count the reasons I should stay one by one they all just fade away"
Abed,"Jeff protected my honor. It was like My Bodyguard, but I was the kid from Meatballs, Jeff was from Full Metal Jacket, and the mustache guy was the brother of the guy in Entourage."
Jeff,Thanks for dumbing that down for us.
Abed,You got it.
Pierce,"What's the deal, Jeff? You leave your stones in your other suit? Why didn't you rap that guy in the face?"
Jeff,For the same reason that I floss and keep my guitar in its case. I'm over 23.
Shirley,"I'm proud of you for handling it peacefully, Jeff. Like a certain little birthday boy. Heh-heh-heh. Real men turn the other cheek. Let's see them."
Pierce,Nonsense. Men were wired to fight each other so women could choose the right mate.
Britta,"No, the real reason men fight is to release their pent-up gayness."
Pierce,"That guy wasn't g*y, he had a mustache."
Jeff,You know what I have? Finals. Are we cramming for Spanish or not? I need a 65 or I'm gonna flunk the class.
Annie,Why didn't you do the extra credit if you knew that you were failing?
Jeff,Because doing more than the minimum work is my definition of failing.
Shirley,Quick question. Are you all coming to my Christmas party right after the final or are you stopping home to change into your Christmas outfits?
Annie,I guess I could wear one of my Hanukkah sweaters.
Shirley,"Ah. Annie, I didn't know you weren't, um, Christian."
Annie,"Yep, one might even say I'm Jewish."
Shirley,"Oh, that's good for you. That's wonderful. I respect all religions of the world."
Abed,I'm Muslim.
Troy,Jehovah's Witness.
Britta,Atheist.
Shirley,The Lord is testing me.
Jeff,"Guys, this is a subject that breeds conflict, can we please...?"
Abed,"What religion are you, Jeff?"
Jeff,I'm agnostic.
Pierce,Agnostic. Lazy man's atheist. I'm born-again.
Shirley,Oh!
Pierce,We had a re-birthing ritual in my friend's hot tub. I'm now a level five Laser Lotus in my Buddhist community.
Britta,"Uh, that does not sound like Buddhism. Are you sure you're not in a cult?"
Pierce,"Just by asking me that question, you put me back down to a level four. You now owe me 2000 Energon Cubes."
Troy,"Do you know how foolish you sound right now? What else do you believe in, blood transfusions?"
Shirley,"Jehovah's Witnesses are a type of Christian, right, Troy?"
Troy,"Yeah, but we don't celebrate birthdays or Christmas, and we can't drink. But it helps."
Abed,So you're like a Muslim. Assalamu alaikum.
Troy,Shama-lama-ding-dong.
Shirley,"Well, don't we have a diverse little family. I say we open up this party to all faiths. I brought my Star of Bethlehem, which led the wise men to the savior of all mankind. And you guys can bring a little trinket or doodad from your philosophies. Sounds good?"
Jeff,"As an agnostic, I'm gonna bring my winning smile."
Chang,Ugh! So boring.
Shirley,"Done. Hee, hee! Feliz navidad."
Jeff,"""True or falso or none of the above?"" That doesn't make any sense."
Mike,"Hey, look at that, Forehead's taking a test."
Jeff,"Why don't you get going, Chuck Norris?"
Mike,Did you just shoo me?
Britta,Why don't you just kiss him already?
Mike,"Dude, I will shoo your nose down your throat."
Jeff,"Señor Chang, can you do something about this?"
Chang,I'll allow it.
Mike,"Qué pasa here, huh? It's usted, dude. Even I know that."
Jeff,"You picked the wrong day to correct my Spanish, No Sleeves. It's on."
Abed,He's doing this for me. He's my bodyguard.
Mike,You wanna dance?
Britta,Maybe to some show tunes?
Jeff,"No, I want to beat the crap outta you, and I'm gonna enjoy it. Because you're like this school. You're obnoxious, cramping my style and you smell like french-fry oil."
Mike,I don't get it!
Jeff,"Three o'clock! Bike rack, but not the one by the parking lot!"
Mike,"Right, the one by the trash cans, near the orange cones, where they're building the wheelchair ramp!"
Jeff,Yeah.
Chang,Best exam ever. That guy's awesome.
Jeff,"So help me, if that jerkweed made me fail."
Pierce,"Well, I aced it, amigo. That means cousin."
Abed,"So, what's my role going to be? Is there a key moment where I finally stand up for myself, take revenge on the villain?"
Jeff,"Uh, maybe you should just hang back."
Abed,"Yeah, I will. In his face."
Jeff,"Whatever you do, don't tell Shirley about the fight. She'll start in with all her mothery guilt-inducing powers. You know what I mean?"
Troy,No. I'm wearing this Jesus bracelet because it gets me chicks.
Pierce,"I know guys like this Mike. He used to be a nerd, now he's a meathead. Dangerous combo. Tyson, Lou Ferrigno, Rosie O'Donnell."
Troy,You're a pretty big dude. You've probably got some moves.
Jeff,"Yeah, I got some theories."
Abed,You've never been in a fight?
Jeff,"Technically, no. I guess I'm too charming and likable. Call me a name."
Troy,I can't.
Jeff,Mm.
Pierce,Are you telling me you've never been punched in the face?
Jeff,"No, thank God. This is the moneymaker."
Troy,"First time I got punched in the face, I was like, ""Oh, no."" But then I was like, ""This is a story."""
Jeff,And a good one.
Troy,Yeah.
Pierce,"Every man should be punched in the face. It's a rite of passage. In my day, Friday night was smoke a doobie, feel up a gal and then get your teeth knocked out by a Republican."
Jeff,"Guys, the plan here isn't for me to get hit. It's for me to hit him."
Pierce,"Oh, then it's settled. We have to teach Jeffrey how to fight. I know a few moves. Troy, I assume you're handy with a switchblade. Abed, you get back to the family tent, try to find a chicken for Jeff to chase."
Jeff,"Guys, I appreciate the enthusiasm, but I think I got this."
Mike,"Oh, well, look who it is. We got Forehead, Old Head, Dumb Head and the Other Head. See you at 3, Forehead. Give me a snowman, dork. See this, funny guy? Huh? Huh?"
Pierce,Classic Rosie.
Troy,Fight lessons in a half an hour?
Jeff,Good plan.
Shirley,"Joy to the world, the Lord is come The Lord, the Lord, the Lord Hello. Oh! Is this your Hanukkah holder? It's, uh... It's pretty. We'll just, uh... Let's just put it here. There we go. That's nice. So I can't believe I never knew you were a Jew."
Annie,I'd say the whole word next time.
Shirley,So do you think everyone will start arriving soon?
Annie,I think they're gonna come after Jeff's fight.
Shirley,"After Jeff's what, now?"
Annie,Jeff wants to fight that bully.
Shirley,On Christmas? Will you excuse me for a moment? Can you finish the manger scene?
Annie,We know you were one of us.
Troy,What's up? What's up?
Jeff,'Sup?
Troy,"No, it's a question. 'Sup?"
Jeff,'Sup?
Troy,"Not a real question, a rhetorical one. You have the answer, he does not. Then you give them the Forest Whitaker eye."
Jeff,"Oh, that's pretty good."
Troy,"Okay, hold that stare. There you go. Hold it. Then, look straight through his eyes and deep into his soul."
Britta,And then you move to Vermont.
Troy,I am sick and tired of you saying that fighting is g*y.
Abed,"She's got a point. In boxing, you fight for the purse and a belt."
Britta,I've gotta write a paper about that.
Pierce,"Let's see what we're working with. Go ahead, throw a few at the old paws. What are you? A North Korean seamstress?"
Jeff,Not if that's bad.
Pierce,"Get mad, come on! If it helps, think of me as somebody who annoys you. That's it. That's good. Britta, put your blouse back on."
Jeff,Ohh! Ow!
Pierce,This is not a game. You gotta be ready for anything.
Troy,"Dude, that is not cool."
Pierce,"Well, that foxy black girl thinks it is."
Troy,Hm? Aah!
Jeff,What are you doing?
Troy,Why she have to be black?
Shirley,What is going on?
Troy,We're trying to get Jeff ready for the fight. I couldn't think of another word.
Jeff,Idiot. He meant we were figh... ting. It is hard to think of another word.
Shirley,You realize there's no way to take this than as a giant middle finger to the most important day of the year.
Jeff,December 10th?
Shirley,"It's our Christmas. And I'm having a party. Due to my divorce, and my relatives picking sides, this will be the only Christmas party I throw this year. Will you be there or will I have another family letting me down?"
Pierce,I told him not to fight. He wouldn't listen. I don't know what that is.
Shirley,"Jeffrey, I have two boys. And when we have a serious discussion, I find that a brownie helps them to relax. So why do you hate me and Jesus?"
Jeff,I don't think my brownie's working.
Shirley,Please don't do something so ugly on a day so important to me.
Jeff,"Again, it's December 10th."
Shirley,You think religion is stupid.
Jeff,"No, no. To me, religion is like Paul Rudd. I see the appeal and would never take it away from anyone, but I would also never stand in line for it. And, look, the die has been cast with this crazy bully guy. He picked on Abed, and he corrected my Spanish. So you go to your party and I'll see you soon."
Shirley,"Jeffrey, I forbid you from fighting."
Jeff,"Well, you don't get to. You're not my mom."
Shirley,"You're right, but if you show up for the fight, don't show up for my party."
Jeff,"Oh, come on, Shirley, don't be mad."
Shirley,"I'm not mad, I'm disappointed."
Jeff,That's Mom for mad.
Shirley,"Oh, hash browns and applesauce, that's nice. Oh, what is that interesting smell? It's a traditional Muslim dish. Looks delicious. I'm guessing as a woman I won't be allowed to eat that. That's too bad. Oh, look, Britta brought what she believes in. Nothing."
Pierce,Where should I put my Buddha incense holder?
Britta,I'm pretty sure that's a bong.
Annie,Where's Jeff?
Shirley,I guess he made his choice.
Troy,I wanna go to Jeff's fight.
Shirley,"As I told Jeff, no one that goes to the fight can come to my party. He's dead to me. And if any of you leave you'll be dead to me too. Let's sing. Jesus is a friend of mine Jesus is a friend of mine Everybody. Jesus is a friend of mine Come on, everybody. You don't know it?"
Britta,You're banning Jeff from the party? That doesn't seem very Christian.
Shirley,"Well, that's an interesting point of view coming from an atheist. I did my best to create a special Christmas for my one intact family. And, ahem, this is the thanks I get?"
Annie,"Shirley, you are a guilt machine."
Britta,Mm.
Pierce,"And Annie knows a thing or two about guilt, am I right, Jew?"
Annie,Say the whole word.
Pierce,Jewie?
Troy,"You would never catch a Jehovah's Witness saying ""Jewie."""
Pierce,"Tell it to the birthday cake you never got. You know, there's an old Buddhist saying..."
Britta,"You are not a Buddhist, you are in a cult."
Pierce,"Suck it, Nietzsche."
Annie,"Guys, everyone's faith is weird. Let's just not talk about it."
Britta,"Guys, guys, guys, guys. Are we really gonna let religion divide us like this? I think there's one thing we can all agree on."
Abed,I get 72 virgins in heaven.
Britta,"No, that we would all like to have Jeff at this party."
Shirley,Mm. He can't come.
Britta,"Shirley. I get that this is your first Christmas since your husband left you. And I don't know, maybe that's why you're being so stubborn, because you're trying so hard to recreate something that you're afraid that you've lost forever. But if you really want us to be your second family, then you've gotta start treating us like one. Even if that means supporting us when we do things that you don't agree with. And you can start by rooting for Jeff while he rolls around on the ground, groping another man. That's what I'm gonna do."
Shirley,The cranberry sauce has real cranberries.
Mike,"If this dude doesn't show up, we're definitely going to Applebee's. Because I'm getting into a fight no matter what today, I'm telling you. Oh, look who showed up. Oh, check him out. Ohh! What's up, dude? No backup today, huh? Looks like grandpa and weirdo couldn't show up to get their teeth knocked out."
Jeff,Can I ask you a question? Are you perpetually on your way to the gym?
Mike,"Dude, my life is a gym."
Jeff,"Well, what's up? What's up?"
Mike,"What's up, man?"
Jeff,What's up? MIKE. What's up? JEFF. What's up?
Mike,What's up?
Jeff,What's up?
Mike,"Whoa. Dude, what is that?"
Jeff,"One sec, these are very expensive."
Mike,What is he doing?
Jeff,All right.
Mike,"Dude, you wear a bracelet?"
Jeff,"Your name is Mike, right?"
Mike,So?
Jeff,"Mike, I'm not gonna fight you. I have a friend that believes this is the time of year where you put aside your differences and make peace. Me? I don't believe in any of that, but I do believe in friendship. And as much as I hate you and the cast of Breakin', I have to ask myself, what would Shirley do?"
Mike,"Oh, no. What would Shirley do?"
Jeff,I think that she would shake your hand and wish you a Merry Christmas.
Shirley,Jeffrey. Kick his a*s.
Mike,"Cavalry's here. Shirts off, boys."
Britta,"Come on, I'm being punk'd, right?"
Mike,Kick them. Come here. MIKE'
S Friend,"Please, it's Christmas."
Shirley,It's December 10th.
Jeff,"Not the moneymaker, not the moneymaker."
Pierce,You're welcome. SHIRLEY: Sensible night Appropriate night Snow on ground Left and right Round yon purchase Of decorative things Tolerant rewrite Of carols to sing Function with relative Ease Function with relative Ease
Chang,"Yeah. Thank you. Yeah. Yeah. Thank you. Thank you, I get it. Yes, it is I, Señor Chang. Shakira, hold this. So I have finished grading everyone's finals. And all of you are moving on."
Shirley,"Yes! CHANG; Yeah. Ha, ha. Except for Jeff."
Shirley,Oh.
Chang,"It turns out, you... Pause for dramatic effect... will be seeing me next semester."
Annie,No!
Chang,"In Spanish 102, ha-ha-ha! Because he passed, you know. And I'm the only Spanish teacher."
Annie,"Yay! I meant about Jeff passing. You being our Spanish teacher, eh."
Chang,"Whoa. Man, Mike got you good."
Pierce,"Actually, that was my present to Jeff."
Chang,"Ha, ha. I don't care. I've got a mountain to shred."
Pierce,"Jeffrey, you're a man now. How does it feel?"
Jeff,"I got hit in the face, like, four times before you punched me."
Pierce,"Well, some people just don't know how to say thank you."
Jeff,"Pierce, thank you. And thanks to all of you for showing up and having my back when we fought those fly dancers. So, uh... SHIRLEY &"
Annie,Ooh!
Jeff,Merry...
Shirley,"No, no, no, holiday."
Jeff,"Actually, I was gonna say, ""Merry semester and happy new one."""
Abed,Switch?
Shirley,"Switch, switch, next glass."
Pierce,"Okay, he's running out. He's running out."
Abed,O Christmas Troy O Christmas Troy Thy candles shine so brightly O Christmas Troy O Christmas Troy Much pleasure thou canst give me
Jeff,Why do you guys do stuff like this?
Troy,Because it's fun.
Abed,Yeah. JEFF &
Abed,The sight of thee at Christmastide Spreads hope and gladness Far and wide
All,O Christmas Troy O Christmas Troy Thou tree most fair and lovely
Abed,Don't move.
Troy,This nose smells like special drink.
